{
  "milestone_id": "REPLACE_WITH_MILESTONE_ID",
  "maturity": "concept",
  "status": "draft",
  "checks": [
    {
      "check_id": "CHK-001",
      "name": "Required files exist",
      "result": "not_run",
      "evidence": "",
      "limitations": []
    }
  ],
  "gates": [
    {
      "gate_id": "Gate 0",
      "name": "doctor / environment preflight",
      "result": "not_run",
      "evidence": "",
      "smallest_unblock_step": "Run ./zen-cad doctor --cad-required before CAD generation."
    },
    {
      "gate_id": "Gate 2",
      "name": "standard part source-lock",
      "result": "not_run",
      "evidence": "",
      "smallest_unblock_step": "Run ./zen-cad source-lock milestones/<id> and resolve all source-lock blockers."
    },
    {
      "gate_id": "Gate 6",
      "name": "CAD-kernel validation",
      "result": "not_run",
      "evidence": "",
      "smallest_unblock_step": "Run kernel-backed load/export/contact/clearance checks before claiming completion."
    }
  ],
  "summary": "TBD"
}
